{
  "runId": "qrst96in89gbitx",
  "commit": "1833e24969b6fcf8c4d3ec335f0e013809bc78cc",
  "target": "local",
  "command": "npm run compliance -- --target local",
  "startedAt": "2026-10-20T12:31:43.921Z",
  "finishedAt": "2026-10-20T13:06:26.158Z",
  "exitStatus": 1,
  "results": [
    {
      "id": "AUTH-AC-001",
      "status": "passed"
    },
    {
      "id": "AUTH-AC-002",
      "status": "passed"
    },
    {
      "id": "AUTH-AC-003",
      "status": "passed"
    },
    {
      "id": "AUTH-AC-004",
      "status": "passed"
    },
    {
      "id": "AUTH-AC-005",
      "status": "passed"
    },
    {
      "id": "AUTH-AC-006",
      "status": "passed"
    },
    {
      "id": "AUTH-AC-007",
      "status": "passed"
    },
    {
      "id": "AUTH-AC-008",
      "status": "passed"
    },
    {
      "id": "AUTH-AC-009",
      "status": "passed"
    },
    {
      "id": "AUTH-AC-010",
      "status": "passed"
    },
    {
      "id": "AUTH-AC-012",
      "status": "passed"
    },
    {
      "id": "CF-AC-003",
      "status": "passed"
    },
    {
      "id": "CFG-AC-001",
      "status": "passed"
    },
    {
      "id": "CFG-AC-002",
      "status": "passed"
    },
    {
      "id": "CFG-AC-003",
      "status": "passed"
    },
    {
      "id": "CFG-AC-004",
      "status": "passed"
    },
    {
      "id": "CFG-AC-005",
      "status": "passed"
    },
    {
      "id": "CFG-AC-006",
      "status": "passed"
    },
    {
      "id": "CHECK-AC-001",
      "status": "passed"
    },
    {
      "id": "CHECK-AC-002",
      "status": "passed"
    },
    {
      "id": "CHECK-AC-003",
      "status": "passed"
    },
    {
      "id": "CHECK-AC-004",
      "status": "passed"
    },
    {
      "id": "CHECK-AC-005",
      "status": "passed"
    },
    {
      "id": "CHECK-AC-005",
      "status": "not-run",
      "detail": "demo part: demo built in phase F (plan C-EV)"
    },
    {
      "id": "CHECK-AC-006",
      "status": "passed"
    },
    {
      "id": "CLI-AC-001",
      "status": "passed"
    },
    {
      "id": "CLI-AC-002",
      "status": "passed"
    },
    {
      "id": "CLI-AC-003",
      "status": "passed"
    },
    {
      "id": "CLI-AC-004",
      "status": "passed"
    },
    {
      "id": "CLI-AC-005",
      "status": "passed"
    },
    {
      "id": "COMPL-AC-001",
      "status": "passed"
    },
    {
      "id": "COMPL-AC-002",
      "status": "passed"
    },
    {
      "id": "COMPL-AC-003",
      "status": "passed"
    },
    {
      "id": "COMPL-AC-006",
      "status": "passed"
    },
    {
      "id": "COMPL-AC-007",
      "status": "passed"
    },
    {
      "id": "CORE-AC-001",
      "status": "passed"
    },
    {
      "id": "CORE-AC-002",
      "status": "passed"
    },
    {
      "id": "CORE-AC-003",
      "status": "passed"
    },
    {
      "id": "CORE-AC-004",
      "status": "passed"
    },
    {
      "id": "CORE-AC-005",
      "status": "passed"
    },
    {
      "id": "CORE-AC-006",
      "status": "passed"
    },
    {
      "id": "CORE-AC-007",
      "status": "passed"
    },
    {
      "id": "CORE-AC-008",
      "status": "passed"
    },
    {
      "id": "DEMO-AC-001",
      "status": "not-run",
      "detail": "no test tagged [DEMO-AC-001] ran on local"
    },
    {
      "id": "DEMO-AC-002",
      "status": "not-run",
      "detail": "no test tagged [DEMO-AC-002] ran on local"
    },
    {
      "id": "DEMO-AC-003",
      "status": "not-run",
      "detail": "no test tagged [DEMO-AC-003] ran on local"
    },
    {
      "id": "DEMO-AC-004",
      "status": "not-run",
      "detail": "no test tagged [DEMO-AC-004] ran on local"
    },
    {
      "id": "DEMO-AC-005",
      "status": "not-run",
      "detail": "no test tagged [DEMO-AC-005] ran on local"
    },
    {
      "id": "DEMO-AC-006",
      "status": "not-run",
      "detail": "no test tagged [DEMO-AC-006] ran on local"
    },
    {
      "id": "DEMO-AC-007",
      "status": "not-run",
      "detail": "no test tagged [DEMO-AC-007] ran on local"
    },
    {
      "id": "DEMO-AC-008",
      "status": "not-run",
      "detail": "no test tagged [DEMO-AC-008] ran on local"
    },
    {
      "id": "DEMO-AC-009",
      "status": "not-run",
      "detail": "no test tagged [DEMO-AC-009] ran on local"
    },
    {
      "id": "DEMO-AC-010",
      "status": "not-run",
      "detail": "no test tagged [DEMO-AC-010] ran on local"
    },
    {
      "id": "DEMO-AC-011",
      "status": "not-run",
      "detail": "no test tagged [DEMO-AC-011] ran on local"
    },
    {
      "id": "E2E-001",
      "status": "passed"
    },
    {
      "id": "E2E-002",
      "status": "not-run",
      "detail": "no test tagged [E2E-002] ran on local"
    },
    {
      "id": "E2E-003",
      "status": "passed"
    },
    {
      "id": "E2E-004",
      "status": "failed",
      "detail": "1 of 2 tests failed: [E2E-004] coverage part: every criterion and scenario applicable on this target has a tagged test in the suite this run executes: Error: applicable on local but no tagged test in this target's suite:"
    },
    {
      "id": "E2E-007",
      "status": "passed"
    },
    {
      "id": "E2E-009",
      "status": "passed"
    },
    {
      "id": "E2E-011",
      "status": "passed"
    },
    {
      "id": "E2E-013",
      "status": "passed"
    },
    {
      "id": "E2E-014",
      "status": "passed"
    },
    {
      "id": "E2E-016",
      "status": "passed"
    },
    {
      "id": "FILES-AC-001",
      "status": "passed"
    },
    {
      "id": "FILES-AC-002",
      "status": "passed"
    },
    {
      "id": "FILES-AC-003",
      "status": "passed"
    },
    {
      "id": "FILES-AC-004",
      "status": "passed"
    },
    {
      "id": "FILES-AC-006",
      "status": "passed"
    },
    {
      "id": "GOOGLE-AC-001",
      "status": "passed"
    },
    {
      "id": "GOOGLE-AC-002",
      "status": "passed"
    },
    {
      "id": "GOOGLE-AC-003",
      "status": "passed"
    },
    {
      "id": "HTTP-AC-001",
      "status": "passed"
    },
    {
      "id": "HTTP-AC-002",
      "status": "passed"
    },
    {
      "id": "HTTP-AC-003",
      "status": "passed"
    },
    {
      "id": "HTTP-AC-006",
      "status": "passed"
    },
    {
      "id": "HTTP-AC-007",
      "status": "passed"
    },
    {
      "id": "KV-AC-001",
      "status": "passed"
    },
    {
      "id": "KV-AC-002",
      "status": "passed"
    },
    {
      "id": "KV-AC-003",
      "status": "passed"
    },
    {
      "id": "KV-AC-004",
      "status": "passed"
    },
    {
      "id": "KV-AC-005",
      "status": "passed"
    },
    {
      "id": "LOCAL-AC-001",
      "status": "passed"
    },
    {
      "id": "LOCAL-AC-002",
      "status": "passed"
    },
    {
      "id": "LOCAL-AC-003",
      "status": "passed"
    },
    {
      "id": "LOCAL-AC-004",
      "status": "passed"
    },
    {
      "id": "LOG-AC-001",
      "status": "passed"
    },
    {
      "id": "LOG-AC-002",
      "status": "passed"
    },
    {
      "id": "LOG-AC-003",
      "status": "passed"
    },
    {
      "id": "LOG-AC-005",
      "status": "passed"
    },
    {
      "id": "MIG-AC-001",
      "status": "passed"
    },
    {
      "id": "MIG-AC-002",
      "status": "passed"
    },
    {
      "id": "MIG-AC-003",
      "status": "passed"
    },
    {
      "id": "PROV-AC-005",
      "status": "passed"
    },
    {
      "id": "PROV-AC-007",
      "status": "passed"
    },
    {
      "id": "SEC-AC-001",
      "status": "passed"
    },
    {
      "id": "SEC-AC-002",
      "status": "passed"
    },
    {
      "id": "SEC-AC-003",
      "status": "passed"
    },
    {
      "id": "SEC-AC-004",
      "status": "passed"
    },
    {
      "id": "SKILL-AC-001",
      "status": "passed"
    },
    {
      "id": "SKILL-AC-002",
      "status": "passed"
    },
    {
      "id": "SKILL-AC-003",
      "status": "passed"
    },
    {
      "id": "SKILL-AC-004",
      "status": "passed"
    },
    {
      "id": "SKILL-AC-005",
      "status": "passed"
    },
    {
      "id": "SQL-AC-001",
      "status": "passed"
    },
    {
      "id": "SQL-AC-002",
      "status": "passed"
    },
    {
      "id": "SQL-AC-003",
      "status": "passed"
    },
    {
      "id": "SQL-AC-004",
      "status": "passed"
    },
    {
      "id": "SQL-AC-005",
      "status": "passed"
    },
    {
      "id": "SQL-AC-006",
      "status": "passed"
    }
  ],
  "versions": {
    "node": "v22.22.0",
    "@lago-morph/prototype-framework": "0.1.0",
    "vitest": "5.0.5",
    "@playwright/test": "1.64.1",
    "wrangler": "4.149.0",
    "typescript": "6.0.3",
    "drizzle-orm": "0.45.4",
    "drizzle-kit": "0.31.11",
    "hono": "4.13.13",
    "zod": "4.6.7",
    "@electric-sql/pglite": "0.5.8",
    "esbuild": "0.28.2",
    "sst": "4.17.2"
  }
}
