{
  "runId": "htth52fbl34gzk7",
  "commit": "285540727943ebe960348056ca26ce3182f0baa2",
  "target": "local",
  "command": "npm run compliance -- --target local",
  "startedAt": "2026-10-25T19:12:58.982Z",
  "finishedAt": "2026-10-25T19:56:54.595Z",
  "exitStatus": 1,
  "results": [
    {
      "id": "AUTH-AC-001",
      "status": "passed"
    },
    {
      "id": "AUTH-AC-002",
      "status": "passed"
    },
    {
      "id": "AUTH-AC-003",
      "status": "passed"
    },
    {
      "id": "AUTH-AC-004",
      "status": "passed"
    },
    {
      "id": "AUTH-AC-005",
      "status": "passed"
    },
    {
      "id": "AUTH-AC-006",
      "status": "passed"
    },
    {
      "id": "AUTH-AC-007",
      "status": "passed"
    },
    {
      "id": "AUTH-AC-008",
      "status": "passed"
    },
    {
      "id": "AUTH-AC-009",
      "status": "passed"
    },
    {
      "id": "AUTH-AC-010",
      "status": "passed"
    },
    {
      "id": "AUTH-AC-012",
      "status": "passed"
    },
    {
      "id": "AUTH-AC-013",
      "status": "passed"
    },
    {
      "id": "AUTH-AC-014",
      "status": "passed"
    },
    {
      "id": "AUTH-AC-015",
      "status": "passed"
    },
    {
      "id": "CF-AC-003",
      "status": "passed"
    },
    {
      "id": "CFG-AC-001",
      "status": "passed"
    },
    {
      "id": "CFG-AC-002",
      "status": "passed"
    },
    {
      "id": "CFG-AC-003",
      "status": "passed"
    },
    {
      "id": "CFG-AC-004",
      "status": "passed"
    },
    {
      "id": "CFG-AC-005",
      "status": "passed"
    },
    {
      "id": "CFG-AC-006",
      "status": "passed"
    },
    {
      "id": "CHECK-AC-001",
      "status": "passed"
    },
    {
      "id": "CHECK-AC-002",
      "status": "passed"
    },
    {
      "id": "CHECK-AC-003",
      "status": "passed"
    },
    {
      "id": "CHECK-AC-004",
      "status": "passed"
    },
    {
      "id": "CHECK-AC-005",
      "status": "passed"
    },
    {
      "id": "CHECK-AC-006",
      "status": "passed"
    },
    {
      "id": "CLI-AC-001",
      "status": "passed"
    },
    {
      "id": "CLI-AC-002",
      "status": "passed"
    },
    {
      "id": "CLI-AC-003",
      "status": "passed"
    },
    {
      "id": "CLI-AC-004",
      "status": "passed"
    },
    {
      "id": "CLI-AC-005",
      "status": "passed"
    },
    {
      "id": "CLI-AC-006",
      "status": "passed"
    },
    {
      "id": "COMPL-AC-001",
      "status": "passed"
    },
    {
      "id": "COMPL-AC-002",
      "status": "passed"
    },
    {
      "id": "COMPL-AC-003",
      "status": "passed"
    },
    {
      "id": "COMPL-AC-006",
      "status": "passed"
    },
    {
      "id": "COMPL-AC-007",
      "status": "passed"
    },
    {
      "id": "CORE-AC-001",
      "status": "failed",
      "detail": "1 of 5 tests failed: CORE-AC-001 type fixtures > [CORE-AC-001] every framework type in a public signature is importable from a subpath its importers may use: AssertionError: expected [ …(2) ] to deeply equal []"
    },
    {
      "id": "CORE-AC-002",
      "status": "passed"
    },
    {
      "id": "CORE-AC-003",
      "status": "passed"
    },
    {
      "id": "CORE-AC-004",
      "status": "passed"
    },
    {
      "id": "CORE-AC-005",
      "status": "passed"
    },
    {
      "id": "CORE-AC-006",
      "status": "passed"
    },
    {
      "id": "CORE-AC-007",
      "status": "passed"
    },
    {
      "id": "CORE-AC-008",
      "status": "passed"
    },
    {
      "id": "DEMO-AC-001",
      "status": "passed"
    },
    {
      "id": "DEMO-AC-002",
      "status": "passed"
    },
    {
      "id": "DEMO-AC-003",
      "status": "passed"
    },
    {
      "id": "DEMO-AC-004",
      "status": "passed"
    },
    {
      "id": "DEMO-AC-005",
      "status": "passed"
    },
    {
      "id": "DEMO-AC-006",
      "status": "passed"
    },
    {
      "id": "DEMO-AC-007",
      "status": "passed"
    },
    {
      "id": "DEMO-AC-008",
      "status": "passed"
    },
    {
      "id": "DEMO-AC-009",
      "status": "passed"
    },
    {
      "id": "DEMO-AC-010",
      "status": "passed"
    },
    {
      "id": "E2E-001",
      "status": "passed"
    },
    {
      "id": "E2E-002",
      "status": "passed"
    },
    {
      "id": "E2E-003",
      "status": "passed"
    },
    {
      "id": "E2E-004",
      "status": "passed"
    },
    {
      "id": "E2E-007",
      "status": "passed"
    },
    {
      "id": "E2E-009",
      "status": "passed"
    },
    {
      "id": "E2E-011",
      "status": "passed"
    },
    {
      "id": "E2E-013",
      "status": "passed"
    },
    {
      "id": "E2E-014",
      "status": "passed"
    },
    {
      "id": "E2E-016",
      "status": "passed"
    },
    {
      "id": "FILES-AC-001",
      "status": "passed"
    },
    {
      "id": "FILES-AC-002",
      "status": "passed"
    },
    {
      "id": "FILES-AC-003",
      "status": "passed"
    },
    {
      "id": "FILES-AC-004",
      "status": "passed"
    },
    {
      "id": "FILES-AC-006",
      "status": "passed"
    },
    {
      "id": "HTTP-AC-001",
      "status": "passed"
    },
    {
      "id": "HTTP-AC-002",
      "status": "passed"
    },
    {
      "id": "HTTP-AC-003",
      "status": "passed"
    },
    {
      "id": "HTTP-AC-006",
      "status": "passed"
    },
    {
      "id": "HTTP-AC-007",
      "status": "passed"
    },
    {
      "id": "KV-AC-001",
      "status": "passed"
    },
    {
      "id": "KV-AC-002",
      "status": "passed"
    },
    {
      "id": "KV-AC-003",
      "status": "passed"
    },
    {
      "id": "KV-AC-004",
      "status": "passed"
    },
    {
      "id": "KV-AC-005",
      "status": "passed"
    },
    {
      "id": "LOCAL-AC-001",
      "status": "passed"
    },
    {
      "id": "LOCAL-AC-002",
      "status": "passed"
    },
    {
      "id": "LOCAL-AC-003",
      "status": "passed"
    },
    {
      "id": "LOCAL-AC-004",
      "status": "passed"
    },
    {
      "id": "LOG-AC-001",
      "status": "passed"
    },
    {
      "id": "LOG-AC-002",
      "status": "passed"
    },
    {
      "id": "LOG-AC-003",
      "status": "passed"
    },
    {
      "id": "LOG-AC-005",
      "status": "passed"
    },
    {
      "id": "MAIL-AC-001",
      "status": "passed"
    },
    {
      "id": "MAIL-AC-002",
      "status": "passed"
    },
    {
      "id": "MAIL-AC-003",
      "status": "passed"
    },
    {
      "id": "MAIL-AC-004",
      "status": "passed"
    },
    {
      "id": "MAIL-AC-005",
      "status": "passed"
    },
    {
      "id": "MIG-AC-001",
      "status": "passed"
    },
    {
      "id": "MIG-AC-002",
      "status": "passed"
    },
    {
      "id": "MIG-AC-003",
      "status": "passed"
    },
    {
      "id": "PROV-AC-005",
      "status": "passed"
    },
    {
      "id": "PROV-AC-007",
      "status": "passed"
    },
    {
      "id": "PWD-AC-001",
      "status": "passed"
    },
    {
      "id": "PWD-AC-002",
      "status": "passed"
    },
    {
      "id": "PWD-AC-003",
      "status": "passed"
    },
    {
      "id": "PWD-AC-004",
      "status": "passed"
    },
    {
      "id": "PWD-AC-005",
      "status": "passed"
    },
    {
      "id": "PWD-AC-006",
      "status": "passed"
    },
    {
      "id": "PWD-AC-007",
      "status": "passed"
    },
    {
      "id": "PWD-AC-010",
      "status": "passed"
    },
    {
      "id": "SEC-AC-001",
      "status": "passed"
    },
    {
      "id": "SEC-AC-002",
      "status": "passed"
    },
    {
      "id": "SEC-AC-003",
      "status": "passed"
    },
    {
      "id": "SEC-AC-004",
      "status": "passed"
    },
    {
      "id": "SKILL-AC-001",
      "status": "passed"
    },
    {
      "id": "SKILL-AC-002",
      "status": "passed"
    },
    {
      "id": "SKILL-AC-003",
      "status": "passed"
    },
    {
      "id": "SKILL-AC-004",
      "status": "passed"
    },
    {
      "id": "SKILL-AC-005",
      "status": "passed"
    },
    {
      "id": "SQL-AC-001",
      "status": "passed"
    },
    {
      "id": "SQL-AC-002",
      "status": "passed"
    },
    {
      "id": "SQL-AC-003",
      "status": "passed"
    },
    {
      "id": "SQL-AC-004",
      "status": "passed"
    },
    {
      "id": "SQL-AC-005",
      "status": "passed"
    },
    {
      "id": "SQL-AC-006",
      "status": "passed"
    }
  ],
  "versions": {
    "node": "v22.22.0",
    "@lago-morph/prototype-framework": "0.1.0",
    "vitest": "5.0.5",
    "@playwright/test": "1.64.1",
    "wrangler": "4.149.0",
    "typescript": "6.0.3",
    "drizzle-orm": "0.45.4",
    "drizzle-kit": "0.31.11",
    "hono": "4.13.13",
    "zod": "4.6.7",
    "@electric-sql/pglite": "0.5.8",
    "esbuild": "0.28.2",
    "sst": "4.17.2"
  }
}
