{
  "runId": "sysad9rajoir4yt",
  "commit": "93e6d7d6dfb0cd7c995e02a43ec7a30451fed447",
  "target": "cloudflare",
  "stage": "test-9mfkg261apxm7s2",
  "command": "npm run compliance -- --target cloudflare --base-url https://reference-test-9mfkg261apxm7s2.<account-subdomain>.workers.dev --stage test-9mfkg261apxm7s2 --milestone --only PROV-AC-004",
  "startedAt": "2026-10-24T03:50:26.205Z",
  "finishedAt": "2026-10-24T03:51:16.486Z",
  "exitStatus": 1,
  "results": [
    {
      "id": "AUTH-AC-005",
      "status": "not-run",
      "detail": "Google login mocked for this phase"
    },
    {
      "id": "COMPL-AC-008",
      "status": "not-run",
      "detail": "not selected for this run (--only)"
    },
    {
      "id": "E2E-007",
      "status": "not-run",
      "detail": "Google login mocked for this phase"
    },
    {
      "id": "E2E-008",
      "status": "not-run",
      "detail": "Google login mocked for this phase"
    },
    {
      "id": "E2E-010",
      "status": "not-run",
      "detail": "not selected for this run (--only)"
    },
    {
      "id": "E2E-012",
      "status": "not-run",
      "detail": "not selected for this run (--only)"
    },
    {
      "id": "E2E-015",
      "status": "not-run",
      "detail": "not selected for this run (--only)"
    },
    {
      "id": "GOOGLE-AC-005",
      "status": "not-run",
      "detail": "Google login mocked for this phase"
    },
    {
      "id": "PROV-AC-003",
      "status": "not-run",
      "detail": "not selected for this run (--only)"
    },
    {
      "id": "PROV-AC-004",
      "status": "blocked",
      "detail": "PROV-AC-004 setup-account (cloud, milestone, no D1) > [PROV-AC-004] deploying on an account without setup-account fails with a clear message and creates nothing: needs a Cloudflare account on which setup-account has never run (set COMPLIANCE_CLOUDFLARE_FRESH_ACCOUNT=1 on such an account); this test never deletes the shared log bucket or state home, which hold other stages' state and retained log entries"
    },
    {
      "id": "PROV-AC-006",
      "status": "not-run",
      "detail": "not selected for this run (--only)"
    },
    {
      "id": "SKILL-AC-006",
      "status": "not-run",
      "detail": "Google login mocked for this phase"
    }
  ],
  "versions": {
    "node": "v22.22.0",
    "@lago-morph/prototype-framework": "0.1.0",
    "vitest": "5.0.5",
    "@playwright/test": "1.64.1",
    "wrangler": "4.149.0",
    "typescript": "6.0.3",
    "drizzle-orm": "0.45.4",
    "drizzle-kit": "0.31.11",
    "hono": "4.13.13",
    "zod": "4.6.7",
    "@electric-sql/pglite": "0.5.8",
    "esbuild": "0.28.2",
    "sst": "4.17.2"
  },
  "leftovers": []
}
