{
  "runId": "5swm2wowq7t3yho",
  "commit": "24327c785337d5145e90a92f12a3cbc563357159",
  "target": "cloudflare",
  "command": "npm run compliance -- --target cloudflare --base-url https://no-run-stage.invalid --only PROV-AC-002",
  "startedAt": "2026-10-24T04:41:10.861Z",
  "finishedAt": "2026-10-24T04:45:43.884Z",
  "exitStatus": 1,
  "results": [
    {
      "id": "AUTH-AC-004",
      "status": "not-run",
      "detail": "not selected for this run (--only)"
    },
    {
      "id": "AUTH-AC-005",
      "status": "not-run",
      "detail": "not selected for this run (--only)"
    },
    {
      "id": "AUTH-AC-006",
      "status": "not-run",
      "detail": "not selected for this run (--only)"
    },
    {
      "id": "AUTH-AC-007",
      "status": "not-run",
      "detail": "not selected for this run (--only)"
    },
    {
      "id": "AUTH-AC-009",
      "status": "not-run",
      "detail": "not selected for this run (--only)"
    },
    {
      "id": "AUTH-AC-011",
      "status": "not-run",
      "detail": "Google login mocked for this phase"
    },
    {
      "id": "CF-AC-001",
      "status": "not-run",
      "detail": "not selected for this run (--only)"
    },
    {
      "id": "CF-AC-002",
      "status": "not-run",
      "detail": "not selected for this run (--only)"
    },
    {
      "id": "CFG-AC-003",
      "status": "not-run",
      "detail": "not selected for this run (--only)"
    },
    {
      "id": "CFG-AC-004",
      "status": "not-run",
      "detail": "not selected for this run (--only)"
    },
    {
      "id": "CFG-AC-005",
      "status": "not-run",
      "detail": "not selected for this run (--only)"
    },
    {
      "id": "CLI-AC-001",
      "status": "not-run",
      "detail": "Google login mocked for this phase"
    },
    {
      "id": "CLI-AC-004",
      "status": "not-run",
      "detail": "not selected for this run (--only)"
    },
    {
      "id": "CLI-AC-005",
      "status": "not-run",
      "detail": "not selected for this run (--only)"
    },
    {
      "id": "COMPL-AC-001",
      "status": "not-run",
      "detail": "not selected for this run (--only)"
    },
    {
      "id": "COMPL-AC-003",
      "status": "not-run",
      "detail": "not selected for this run (--only)"
    },
    {
      "id": "COMPL-AC-004",
      "status": "not-run",
      "detail": "not selected for this run (--only)"
    },
    {
      "id": "COMPL-AC-005",
      "status": "not-run",
      "detail": "Google login mocked for this phase"
    },
    {
      "id": "CORE-AC-002",
      "status": "not-run",
      "detail": "not selected for this run (--only)"
    },
    {
      "id": "CORE-AC-003",
      "status": "not-run",
      "detail": "not selected for this run (--only)"
    },
    {
      "id": "DEMO-AC-001",
      "status": "not-run",
      "detail": "not selected for this run (--only)"
    },
    {
      "id": "DEMO-AC-002",
      "status": "not-run",
      "detail": "not selected for this run (--only)"
    },
    {
      "id": "DEMO-AC-003",
      "status": "not-run",
      "detail": "not selected for this run (--only)"
    },
    {
      "id": "DEMO-AC-004",
      "status": "not-run",
      "detail": "not selected for this run (--only)"
    },
    {
      "id": "DEMO-AC-005",
      "status": "not-run",
      "detail": "not selected for this run (--only)"
    },
    {
      "id": "DEMO-AC-007",
      "status": "not-run",
      "detail": "not selected for this run (--only)"
    },
    {
      "id": "DEMO-AC-008",
      "status": "not-run",
      "detail": "not selected for this run (--only)"
    },
    {
      "id": "DEMO-AC-009",
      "status": "not-run",
      "detail": "not selected for this run (--only)"
    },
    {
      "id": "DEMO-AC-010",
      "status": "not-run",
      "detail": "not selected for this run (--only)"
    },
    {
      "id": "E2E-002",
      "status": "not-run",
      "detail": "not selected for this run (--only)"
    },
    {
      "id": "E2E-004",
      "status": "not-run",
      "detail": "not selected for this run (--only)"
    },
    {
      "id": "E2E-005",
      "status": "not-run",
      "detail": "not selected for this run (--only)"
    },
    {
      "id": "E2E-006",
      "status": "not-run",
      "detail": "Google login mocked for this phase"
    },
    {
      "id": "E2E-009",
      "status": "not-run",
      "detail": "not selected for this run (--only)"
    },
    {
      "id": "E2E-011",
      "status": "not-run",
      "detail": "not selected for this run (--only)"
    },
    {
      "id": "E2E-013",
      "status": "not-run",
      "detail": "not selected for this run (--only)"
    },
    {
      "id": "E2E-014",
      "status": "not-run",
      "detail": "not selected for this run (--only)"
    },
    {
      "id": "FILES-AC-001",
      "status": "not-run",
      "detail": "not selected for this run (--only)"
    },
    {
      "id": "FILES-AC-002",
      "status": "not-run",
      "detail": "not selected for this run (--only)"
    },
    {
      "id": "FILES-AC-003",
      "status": "not-run",
      "detail": "not selected for this run (--only)"
    },
    {
      "id": "FILES-AC-004",
      "status": "not-run",
      "detail": "not selected for this run (--only)"
    },
    {
      "id": "FILES-AC-005",
      "status": "not-run",
      "detail": "not selected for this run (--only)"
    },
    {
      "id": "GOOGLE-AC-001",
      "status": "not-run",
      "detail": "Google login mocked for this phase"
    },
    {
      "id": "HTTP-AC-001",
      "status": "not-run",
      "detail": "not selected for this run (--only)"
    },
    {
      "id": "HTTP-AC-002",
      "status": "not-run",
      "detail": "not selected for this run (--only)"
    },
    {
      "id": "HTTP-AC-003",
      "status": "not-run",
      "detail": "not selected for this run (--only)"
    },
    {
      "id": "HTTP-AC-004",
      "status": "not-run",
      "detail": "not selected for this run (--only)"
    },
    {
      "id": "HTTP-AC-005",
      "status": "not-run",
      "detail": "not selected for this run (--only)"
    },
    {
      "id": "KV-AC-001",
      "status": "not-run",
      "detail": "not selected for this run (--only)"
    },
    {
      "id": "KV-AC-002",
      "status": "not-run",
      "detail": "not selected for this run (--only)"
    },
    {
      "id": "KV-AC-003",
      "status": "not-run",
      "detail": "not selected for this run (--only)"
    },
    {
      "id": "KV-AC-004",
      "status": "not-run",
      "detail": "not selected for this run (--only)"
    },
    {
      "id": "KV-AC-005",
      "status": "not-run",
      "detail": "not selected for this run (--only)"
    },
    {
      "id": "LOG-AC-001",
      "status": "not-run",
      "detail": "not selected for this run (--only)"
    },
    {
      "id": "LOG-AC-002",
      "status": "not-run",
      "detail": "not selected for this run (--only)"
    },
    {
      "id": "LOG-AC-004",
      "status": "not-run",
      "detail": "not selected for this run (--only)"
    },
    {
      "id": "LOG-AC-005",
      "status": "not-run",
      "detail": "not selected for this run (--only)"
    },
    {
      "id": "MIG-AC-002",
      "status": "not-run",
      "detail": "not selected for this run (--only)"
    },
    {
      "id": "MIG-AC-003",
      "status": "not-run",
      "detail": "not selected for this run (--only)"
    },
    {
      "id": "MIG-AC-006",
      "status": "not-run",
      "detail": "not selected for this run (--only)"
    },
    {
      "id": "PROV-AC-001",
      "status": "not-run",
      "detail": "not selected for this run (--only)"
    },
    {
      "id": "PROV-AC-002",
      "status": "blocked",
      "detail": "PROV-AC-002 preflight (cloud, no D1) > [PROV-AC-002] Cloudflare: with a credential lacking the permission to create R2 API tokens, deploy names that permission and stops before creating anything: needs a Cloudflare API token without the permission to create R2 API tokens in COMPLIANCE_CLOUDFLARE_TOKEN_WITHOUT_R2_TOKEN_PERMISSION"
    },
    {
      "id": "SEC-AC-001",
      "status": "not-run",
      "detail": "not selected for this run (--only)"
    },
    {
      "id": "SEC-AC-002",
      "status": "not-run",
      "detail": "not selected for this run (--only)"
    },
    {
      "id": "SEC-AC-003",
      "status": "not-run",
      "detail": "not selected for this run (--only)"
    },
    {
      "id": "SEC-AC-005",
      "status": "not-run",
      "detail": "not selected for this run (--only)"
    },
    {
      "id": "SQL-AC-003",
      "status": "not-run",
      "detail": "not selected for this run (--only)"
    },
    {
      "id": "SQL-AC-004",
      "status": "not-run",
      "detail": "not selected for this run (--only)"
    },
    {
      "id": "SQL-AC-005",
      "status": "not-run",
      "detail": "not selected for this run (--only)"
    },
    {
      "id": "SQL-AC-006",
      "status": "not-run",
      "detail": "not selected for this run (--only)"
    }
  ],
  "versions": {
    "node": "v22.22.0",
    "@lago-morph/prototype-framework": "0.1.0",
    "vitest": "5.0.5",
    "@playwright/test": "1.64.1",
    "wrangler": "4.149.0",
    "typescript": "6.0.3",
    "drizzle-orm": "0.45.4",
    "drizzle-kit": "0.31.11",
    "hono": "4.13.13",
    "zod": "4.6.7",
    "@electric-sql/pglite": "0.5.8",
    "esbuild": "0.28.2",
    "sst": "4.17.2"
  },
  "leftovers": []
}
