{
  "runId": "rx3n81izmc4esca",
  "commit": "876686adad88401a2854d9f4d3faff607699cc1a",
  "target": "aws",
  "stage": "test-rx3n81izmc4esca",
  "command": "npm run compliance -- --target aws --only AWS-AC-002 --out validation/local/phase-G/aws-dry-run",
  "startedAt": "2026-10-24T10:12:12.884Z",
  "finishedAt": "2026-10-24T10:13:11.541Z",
  "exitStatus": 1,
  "results": [
    {
      "id": "AUTH-AC-004",
      "status": "not-run",
      "detail": "not selected for this run (--only)"
    },
    {
      "id": "AUTH-AC-005",
      "status": "not-run",
      "detail": "not selected for this run (--only)"
    },
    {
      "id": "AUTH-AC-006",
      "status": "not-run",
      "detail": "not selected for this run (--only)"
    },
    {
      "id": "AUTH-AC-007",
      "status": "not-run",
      "detail": "not selected for this run (--only)"
    },
    {
      "id": "AUTH-AC-009",
      "status": "not-run",
      "detail": "not selected for this run (--only)"
    },
    {
      "id": "AUTH-AC-011",
      "status": "not-run",
      "detail": "Google login mocked for this phase"
    },
    {
      "id": "AWS-AC-001",
      "status": "not-run",
      "detail": "not selected for this run (--only)"
    },
    {
      "id": "AWS-AC-002",
      "status": "failed",
      "detail": "1 of 1 tests failed: AWS-AC-002 no NAT, no VPC-attached Lambda (aws) > [AWS-AC-002] the stage contains no NAT gateway and none of its Lambda functions is attached to a VPC: Error: listing Lambda functions failed: PrerequisiteMissingError"
    },
    {
      "id": "AWS-AC-003",
      "status": "not-run",
      "detail": "not selected for this run (--only)"
    },
    {
      "id": "AWS-AC-004",
      "status": "not-run",
      "detail": "not selected for this run (--only)"
    },
    {
      "id": "AWS-AC-005",
      "status": "not-run",
      "detail": "not selected for this run (--only)"
    },
    {
      "id": "AWS-AC-006",
      "status": "not-run",
      "detail": "not selected for this run (--only)"
    },
    {
      "id": "CFG-AC-003",
      "status": "not-run",
      "detail": "not selected for this run (--only)"
    },
    {
      "id": "CFG-AC-004",
      "status": "not-run",
      "detail": "not selected for this run (--only)"
    },
    {
      "id": "CFG-AC-005",
      "status": "not-run",
      "detail": "not selected for this run (--only)"
    },
    {
      "id": "CLI-AC-001",
      "status": "not-run",
      "detail": "Google login mocked for this phase"
    },
    {
      "id": "CLI-AC-004",
      "status": "not-run",
      "detail": "not selected for this run (--only)"
    },
    {
      "id": "CLI-AC-005",
      "status": "not-run",
      "detail": "not selected for this run (--only)"
    },
    {
      "id": "COMPL-AC-001",
      "status": "not-run",
      "detail": "not selected for this run (--only)"
    },
    {
      "id": "COMPL-AC-003",
      "status": "not-run",
      "detail": "not selected for this run (--only)"
    },
    {
      "id": "COMPL-AC-004",
      "status": "not-run",
      "detail": "not selected for this run (--only)"
    },
    {
      "id": "COMPL-AC-005",
      "status": "not-run",
      "detail": "Google login mocked for this phase"
    },
    {
      "id": "CORE-AC-002",
      "status": "not-run",
      "detail": "not selected for this run (--only)"
    },
    {
      "id": "CORE-AC-003",
      "status": "not-run",
      "detail": "not selected for this run (--only)"
    },
    {
      "id": "DEMO-AC-001",
      "status": "not-run",
      "detail": "not selected for this run (--only)"
    },
    {
      "id": "DEMO-AC-002",
      "status": "not-run",
      "detail": "not selected for this run (--only)"
    },
    {
      "id": "DEMO-AC-003",
      "status": "not-run",
      "detail": "not selected for this run (--only)"
    },
    {
      "id": "DEMO-AC-004",
      "status": "not-run",
      "detail": "not selected for this run (--only)"
    },
    {
      "id": "DEMO-AC-005",
      "status": "not-run",
      "detail": "not selected for this run (--only)"
    },
    {
      "id": "DEMO-AC-007",
      "status": "not-run",
      "detail": "not selected for this run (--only)"
    },
    {
      "id": "DEMO-AC-008",
      "status": "not-run",
      "detail": "not selected for this run (--only)"
    },
    {
      "id": "DEMO-AC-009",
      "status": "not-run",
      "detail": "not selected for this run (--only)"
    },
    {
      "id": "DEMO-AC-010",
      "status": "not-run",
      "detail": "not selected for this run (--only)"
    },
    {
      "id": "E2E-002",
      "status": "not-run",
      "detail": "not selected for this run (--only)"
    },
    {
      "id": "E2E-004",
      "status": "not-run",
      "detail": "not selected for this run (--only)"
    },
    {
      "id": "E2E-005",
      "status": "not-run",
      "detail": "not selected for this run (--only)"
    },
    {
      "id": "E2E-006",
      "status": "not-run",
      "detail": "Google login mocked for this phase"
    },
    {
      "id": "E2E-009",
      "status": "not-run",
      "detail": "not selected for this run (--only)"
    },
    {
      "id": "E2E-011",
      "status": "not-run",
      "detail": "not selected for this run (--only)"
    },
    {
      "id": "E2E-013",
      "status": "not-run",
      "detail": "not selected for this run (--only)"
    },
    {
      "id": "E2E-014",
      "status": "not-run",
      "detail": "not selected for this run (--only)"
    },
    {
      "id": "FILES-AC-001",
      "status": "not-run",
      "detail": "not selected for this run (--only)"
    },
    {
      "id": "FILES-AC-002",
      "status": "not-run",
      "detail": "not selected for this run (--only)"
    },
    {
      "id": "FILES-AC-003",
      "status": "not-run",
      "detail": "not selected for this run (--only)"
    },
    {
      "id": "FILES-AC-004",
      "status": "not-run",
      "detail": "not selected for this run (--only)"
    },
    {
      "id": "FILES-AC-005",
      "status": "not-run",
      "detail": "not selected for this run (--only)"
    },
    {
      "id": "GOOGLE-AC-001",
      "status": "not-run",
      "detail": "Google login mocked for this phase"
    },
    {
      "id": "HTTP-AC-001",
      "status": "not-run",
      "detail": "not selected for this run (--only)"
    },
    {
      "id": "HTTP-AC-002",
      "status": "not-run",
      "detail": "not selected for this run (--only)"
    },
    {
      "id": "HTTP-AC-003",
      "status": "not-run",
      "detail": "not selected for this run (--only)"
    },
    {
      "id": "HTTP-AC-004",
      "status": "not-run",
      "detail": "not selected for this run (--only)"
    },
    {
      "id": "HTTP-AC-005",
      "status": "not-run",
      "detail": "not selected for this run (--only)"
    },
    {
      "id": "KV-AC-001",
      "status": "not-run",
      "detail": "not selected for this run (--only)"
    },
    {
      "id": "KV-AC-002",
      "status": "not-run",
      "detail": "not selected for this run (--only)"
    },
    {
      "id": "KV-AC-003",
      "status": "not-run",
      "detail": "not selected for this run (--only)"
    },
    {
      "id": "KV-AC-004",
      "status": "not-run",
      "detail": "not selected for this run (--only)"
    },
    {
      "id": "KV-AC-005",
      "status": "not-run",
      "detail": "not selected for this run (--only)"
    },
    {
      "id": "LOG-AC-001",
      "status": "not-run",
      "detail": "not selected for this run (--only)"
    },
    {
      "id": "LOG-AC-002",
      "status": "not-run",
      "detail": "not selected for this run (--only)"
    },
    {
      "id": "LOG-AC-004",
      "status": "not-run",
      "detail": "not selected for this run (--only)"
    },
    {
      "id": "LOG-AC-005",
      "status": "not-run",
      "detail": "not selected for this run (--only)"
    },
    {
      "id": "MIG-AC-002",
      "status": "not-run",
      "detail": "not selected for this run (--only)"
    },
    {
      "id": "MIG-AC-003",
      "status": "not-run",
      "detail": "not selected for this run (--only)"
    },
    {
      "id": "MIG-AC-006",
      "status": "not-run",
      "detail": "not selected for this run (--only)"
    },
    {
      "id": "PROV-AC-001",
      "status": "not-run",
      "detail": "not selected for this run (--only)"
    },
    {
      "id": "PROV-AC-002",
      "status": "not-run",
      "detail": "not selected for this run (--only)"
    },
    {
      "id": "SEC-AC-001",
      "status": "not-run",
      "detail": "not selected for this run (--only)"
    },
    {
      "id": "SEC-AC-002",
      "status": "not-run",
      "detail": "not selected for this run (--only)"
    },
    {
      "id": "SEC-AC-003",
      "status": "not-run",
      "detail": "not selected for this run (--only)"
    },
    {
      "id": "SEC-AC-005",
      "status": "not-run",
      "detail": "not selected for this run (--only)"
    },
    {
      "id": "SQL-AC-003",
      "status": "not-run",
      "detail": "not selected for this run (--only)"
    },
    {
      "id": "SQL-AC-004",
      "status": "not-run",
      "detail": "not selected for this run (--only)"
    },
    {
      "id": "SQL-AC-005",
      "status": "not-run",
      "detail": "not selected for this run (--only)"
    },
    {
      "id": "SQL-AC-006",
      "status": "not-run",
      "detail": "not selected for this run (--only)"
    }
  ],
  "versions": {
    "node": "v22.22.0",
    "@lago-morph/prototype-framework": "0.1.0",
    "vitest": "5.0.5",
    "@playwright/test": "1.64.1",
    "wrangler": "4.149.0",
    "typescript": "6.0.3",
    "drizzle-orm": "0.45.4",
    "drizzle-kit": "0.31.11",
    "hono": "4.13.13",
    "zod": "4.6.7",
    "@electric-sql/pglite": "0.5.8",
    "esbuild": "0.28.2",
    "sst": "4.17.2"
  },
  "leftovers": []
}
