{
  "runId": "y5cuhf8fwk5khtd",
  "commit": "1d9623e8ea6256c355e5638a5df8a60654253ed0",
  "target": "cloudflare",
  "command": "npm run compliance -- --target cloudflare --base-url https://no-run-stage.invalid --milestone --only PROV-AC-004,MAIL-AC-007",
  "startedAt": "2026-10-25T07:30:08.751Z",
  "finishedAt": "2026-10-25T07:31:23.285Z",
  "exitStatus": 1,
  "results": [
    {
      "id": "COMPL-AC-008",
      "status": "not-run",
      "detail": "not selected for this run (--only)"
    },
    {
      "id": "E2E-010",
      "status": "not-run",
      "detail": "not selected for this run (--only)"
    },
    {
      "id": "E2E-012",
      "status": "not-run",
      "detail": "not selected for this run (--only)"
    },
    {
      "id": "E2E-015",
      "status": "not-run",
      "detail": "not selected for this run (--only)"
    },
    {
      "id": "MAIL-AC-007",
      "status": "failed",
      "detail": "1 of 1 tests failed: MAIL-AC-007 the account's mail sink (cloud, milestone) > [MAIL-AC-007] setup-account twice changes nothing the second time; the sending entry is verified, t.<domain> routes sink@ to prototype-mailsink with subaddressing on, the bucket keeps mail PAR-241; a sink+<run ID>@ message is readable with mail last; removing a stage leaves all of these: AssertionError: the sending entry is verified: {\"id\":\"<HEX32+>\",\"tag\":\"<HEX32+>\",\"name\":\"shareplay.com\",\"enabled\":true,\"preview_enabled\":true,\"return_path_domain\":\"cf-bounce.shareplay.com\",\"dkim_selector\":\"cf-bounce\",\"drop_suppressed_recipients\":false,…"
    },
    {
      "id": "PROV-AC-003",
      "status": "not-run",
      "detail": "not selected for this run (--only)"
    },
    {
      "id": "PROV-AC-004",
      "status": "blocked",
      "detail": "PROV-AC-004 setup-account (cloud, milestone, no D1) > [PROV-AC-004] deploying on an account without setup-account fails with a clear message and creates nothing: needs a Cloudflare account on which setup-account has never run (set COMPLIANCE_CLOUDFLARE_FRESH_ACCOUNT=1 on such an account); this test never deletes the shared log bucket or state home, which hold other stages' state and retained log entries; PROV-AC-004 setup-account (cloud, milestone, no D1) > [PROV-AC-004] with a token lacking one email permission of DEC-0515, setup-account and a production stage's deploy name that permission and change nothing: needs a Cloudflare API token lacking exactly one email permission of DEC-0515 in COMPLIANCE_CLOUDFLARE_TOKEN_WITHOUT_EMAIL_PERMISSION"
    },
    {
      "id": "PROV-AC-006",
      "status": "not-run",
      "detail": "not selected for this run (--only)"
    },
    {
      "id": "SKILL-AC-006",
      "status": "not-run",
      "detail": "password login provider not implemented yet (DEC-0509)"
    }
  ],
  "versions": {
    "node": "v22.22.0",
    "@lago-morph/prototype-framework": "0.1.0",
    "vitest": "5.0.5",
    "@playwright/test": "1.64.1",
    "wrangler": "4.149.0",
    "typescript": "6.0.3",
    "drizzle-orm": "0.45.4",
    "drizzle-kit": "0.31.11",
    "hono": "4.13.13",
    "zod": "4.6.7",
    "@electric-sql/pglite": "0.5.8",
    "esbuild": "0.28.2",
    "sst": "4.17.2"
  },
  "leftovers": []
}
